{
  "schema": "@baron1996/kline-scene",
  "version": 1,
  "runtime": {
    "engine": "klinecharts",
    "engineVersion": "10.0.0",
    "runtimeVersion": "0.2.0"
  },
  "symbol": {
    "ticker": "AAPL.US",
    "pricePrecision": 3,
    "volumePrecision": 0
  },
  "period": {
    "span": 1,
    "type": "day"
  },
  "data": [
    {
      "timestamp": 1781582400000,
      "open": 295.245,
      "high": 300.48,
      "low": 293.97,
      "close": 299.24,
      "volume": 39874404,
      "turnover": 11903650687
    },
    {
      "timestamp": 1781668800000,
      "open": 300.845,
      "high": 302.07,
      "low": 294.36,
      "close": 295.95,
      "volume": 42745060,
      "turnover": 12699623269
    },
    {
      "timestamp": 1781755200000,
      "open": 298.11,
      "high": 300.57,
      "low": 295.62,
      "close": 298.01,
      "volume": 85962201,
      "turnover": 25622373702
    },
    {
      "timestamp": 1782100800000,
      "open": 297.31,
      "high": 302.42,
      "low": 296.76,
      "close": 297.01,
      "volume": 44879914,
      "turnover": 13404472064
    },
    {
      "timestamp": 1782187200000,
      "open": 297.538,
      "high": 301.64,
      "low": 294.18,
      "close": 294.3,
      "volume": 52010929,
      "turnover": 15440778268
    },
    {
      "timestamp": 1782273600000,
      "open": 295.355,
      "high": 299.7,
      "low": 292.94,
      "close": 293.08,
      "volume": 53081859,
      "turnover": 15651500922
    },
    {
      "timestamp": 1782360000000,
      "open": 287.4,
      "high": 288.8,
      "low": 273.75,
      "close": 275.15,
      "volume": 107253659,
      "turnover": 29757167342
    },
    {
      "timestamp": 1782446400000,
      "open": 275,
      "high": 285.95,
      "low": 274.21,
      "close": 283.78,
      "volume": 261775450,
      "turnover": 73905584274
    },
    {
      "timestamp": 1782705600000,
      "open": 286.73,
      "high": 288.37,
      "low": 279.85,
      "close": 281.74,
      "volume": 66427002,
      "turnover": 18737285008
    },
    {
      "timestamp": 1782792000000,
      "open": 281.17,
      "high": 289.94,
      "low": 280.695,
      "close": 289.36,
      "volume": 65100155,
      "turnover": 18754646632
    },
    {
      "timestamp": 1782878400000,
      "open": 293.44,
      "high": 296.59,
      "low": 289.195,
      "close": 294.38,
      "volume": 50164232,
      "turnover": 14751488171
    },
    {
      "timestamp": 1782964800000,
      "open": 294.12,
      "high": 309.42,
      "low": 293.68,
      "close": 308.63,
      "volume": 75400626,
      "turnover": 23106283637
    },
    {
      "timestamp": 1783310400000,
      "open": 307.36,
      "high": 314.2,
      "low": 307,
      "close": 312.66,
      "volume": 53589977,
      "turnover": 16724565492
    },
    {
      "timestamp": 1783396800000,
      "open": 315.29,
      "high": 315.48,
      "low": 310.15,
      "close": 310.66,
      "volume": 42490002,
      "turnover": 13269549207
    },
    {
      "timestamp": 1783483200000,
      "open": 311.91,
      "high": 314.82,
      "low": 307.05,
      "close": 313.39,
      "volume": 41323480,
      "turnover": 12901706031
    },
    {
      "timestamp": 1783569600000,
      "open": 310.51,
      "high": 316.53,
      "low": 308.16,
      "close": 316.22,
      "volume": 48124490,
      "turnover": 15133298066
    },
    {
      "timestamp": 1783656000000,
      "open": 314.72,
      "high": 316.91,
      "low": 312.17,
      "close": 315.32,
      "volume": 34132321,
      "turnover": 10743293495
    },
    {
      "timestamp": 1783915200000,
      "open": 317.015,
      "high": 323.45,
      "low": 315.78,
      "close": 317.31,
      "volume": 43257804,
      "turnover": 13762625995
    },
    {
      "timestamp": 1784001600000,
      "open": 313.76,
      "high": 316.19,
      "low": 311.91,
      "close": 314.86,
      "volume": 36336829,
      "turnover": 11433769578
    },
    {
      "timestamp": 1784088000000,
      "open": 317.615,
      "high": 328.73,
      "low": 317.32,
      "close": 327.5,
      "volume": 60957644,
      "turnover": 19862547471
    },
    {
      "timestamp": 1784174400000,
      "open": 328.005,
      "high": 334.68,
      "low": 326.79,
      "close": 333.26,
      "volume": 62970617,
      "turnover": 20879923718
    }
  ],
  "chart": {
    "locale": "en-US",
    "timezone": "America/New_York",
    "layout": {
      "backgroundColor": "rgba(255, 255, 255, 1)",
      "textColor": "rgba(34, 34, 34, 1)",
      "fontFamily": "Baron Sans",
      "fontSize": 12
    },
    "candle": {
      "type": "candle_solid",
      "upColor": "rgba(239, 83, 80, 1)",
      "downColor": "rgba(38, 166, 154, 1)",
      "noChangeColor": "rgba(120, 123, 134, 1)",
      "upBorderColor": "rgba(239, 83, 80, 1)",
      "downBorderColor": "rgba(38, 166, 154, 1)",
      "noChangeBorderColor": "rgba(120, 123, 134, 1)",
      "upWickColor": "rgba(239, 83, 80, 1)",
      "downWickColor": "rgba(38, 166, 154, 1)",
      "noChangeWickColor": "rgba(120, 123, 134, 1)"
    },
    "grid": {
      "horizontalColor": "rgba(225, 226, 230, 1)",
      "verticalColor": "rgba(225, 226, 230, 1)"
    },
    "thousandsSeparator": ",",
    "decimalFold": {
      "enabled": false,
      "threshold": 8
    },
    "zoomAnchor": "cursor",
    "dateFormat": "yyyy-MM-dd",
    "largeNumberFormat": "western"
  },
  "panes": [
    {
      "id": "pane-candle",
      "kind": "candle",
      "order": 0,
      "height": 480,
      "minHeight": 180,
      "state": "normal",
      "yAxes": [
        {
          "id": "axis-price",
          "role": "primary",
          "position": "right",
          "reverse": false,
          "inside": false,
          "scrollZoomEnabled": true,
          "topGap": 0.15,
          "bottomGap": 0.1,
          "scale": "logarithmic"
        }
      ],
      "indicators": []
    }
  ],
  "overlays": [
    {
      "id": "m2-aapl-neckline-300",
      "type": "horizontalStraightLine",
      "paneId": "pane-candle",
      "visible": true,
      "locked": false,
      "zLevel": 0,
      "mode": "normal",
      "anchor": {
        "value": 300
      },
      "styles": {
        "line": {
          "color": "rgba(41, 98, 255, 1)",
          "size": 1,
          "style": "solid"
        },
        "fill": {
          "color": "rgba(41, 98, 255, 0.15)"
        },
        "text": {
          "color": "rgba(255, 255, 255, 1)",
          "size": 12,
          "family": "Baron Sans",
          "weight": "normal",
          "backgroundColor": "rgba(41, 98, 255, 1)",
          "borderColor": "rgba(41, 98, 255, 1)"
        }
      },
      "metadata": {
        "source": "m2-chart-projection"
      }
    },
    {
      "id": "m2-aapl-target-330",
      "type": "horizontalStraightLine",
      "paneId": "pane-candle",
      "visible": true,
      "locked": false,
      "zLevel": 1,
      "mode": "normal",
      "anchor": {
        "value": 330
      },
      "styles": {
        "line": {
          "color": "rgba(41, 98, 255, 1)",
          "size": 1,
          "style": "solid"
        },
        "fill": {
          "color": "rgba(41, 98, 255, 0.15)"
        },
        "text": {
          "color": "rgba(255, 255, 255, 1)",
          "size": 12,
          "family": "Baron Sans",
          "weight": "normal",
          "backgroundColor": "rgba(41, 98, 255, 1)",
          "borderColor": "rgba(41, 98, 255, 1)"
        }
      },
      "metadata": {
        "source": "m2-chart-projection"
      }
    },
    {
      "id": "m2-aapl-measurement-300-330",
      "type": "priceMeasurement",
      "paneId": "pane-candle",
      "visible": true,
      "locked": false,
      "zLevel": 2,
      "mode": "normal",
      "start": {
        "timestamp": 1781582400000,
        "value": 300
      },
      "end": {
        "timestamp": 1784174400000,
        "value": 330
      },
      "styles": {
        "line": {
          "color": "rgba(41, 98, 255, 1)",
          "size": 1,
          "style": "solid"
        },
        "fill": {
          "color": "rgba(41, 98, 255, 0.15)"
        },
        "text": {
          "color": "rgba(255, 255, 255, 1)",
          "size": 12,
          "family": "Baron Sans",
          "weight": "normal",
          "backgroundColor": "rgba(41, 98, 255, 1)",
          "borderColor": "rgba(41, 98, 255, 1)"
        }
      },
      "metadata": {
        "source": "m2-chart-projection"
      }
    }
  ],
  "viewport": {
    "barSpace": 24,
    "rightOffsetDistance": 48,
    "anchorTimestamp": 1784174400000
  },
  "render": {
    "width": 1000,
    "height": 600,
    "deviceScaleFactor": 1,
    "background": "rgba(255, 255, 255, 1)",
    "fontFamily": "Baron Sans",
    "timeoutMs": 10000
  },
  "metadata": {
    "source": "m2-chart-projection",
    "rootFixtureSha256": "7102fb332a9fb65e47e3d5d3b7fb62388fdeabe22fb88c5f69bbc9891fb026cd",
    "affectsReplayHash": false
  }
}
