{
  "schema": "@baron1996/kline-scene",
  "version": 1,
  "runtime": {
    "engine": "klinecharts",
    "engineVersion": "10.0.0",
    "runtimeVersion": "0.1.0"
  },
  "symbol": {
    "ticker": "M1-DEMO",
    "name": "M1 Demo Instrument",
    "pricePrecision": 2,
    "volumePrecision": 0
  },
  "period": {
    "span": 1,
    "type": "day"
  },
  "data": [
    {
      "timestamp": 1753747200000,
      "open": 100.2,
      "high": 101.4,
      "low": 99.8,
      "close": 101.1,
      "volume": 120000,
      "turnover": 12096000
    },
    {
      "timestamp": 1753833600000,
      "open": 101.1,
      "high": 102.2,
      "low": 100.7,
      "close": 101.8,
      "volume": 135000,
      "turnover": 13743000
    },
    {
      "timestamp": 1753920000000,
      "open": 101.8,
      "high": 102.1,
      "low": 100.9,
      "close": 101.25,
      "volume": 128000,
      "turnover": 12960000
    }
  ],
  "chart": {
    "locale": "en-US",
    "timezone": "UTC",
    "layout": {
      "backgroundColor": "rgba(255, 255, 255, 1)",
      "textColor": "rgba(34, 34, 34, 1)",
      "fontFamily": "Baron Sans",
      "fontSize": 12
    },
    "candle": {
      "type": "candle_solid",
      "upColor": "rgba(239, 83, 80, 1)",
      "downColor": "rgba(38, 166, 154, 1)",
      "noChangeColor": "rgba(120, 123, 134, 1)",
      "upBorderColor": "rgba(239, 83, 80, 1)",
      "downBorderColor": "rgba(38, 166, 154, 1)",
      "noChangeBorderColor": "rgba(120, 123, 134, 1)",
      "upWickColor": "rgba(239, 83, 80, 1)",
      "downWickColor": "rgba(38, 166, 154, 1)",
      "noChangeWickColor": "rgba(120, 123, 134, 1)"
    },
    "grid": {
      "horizontalColor": "rgba(225, 226, 230, 1)",
      "verticalColor": "rgba(225, 226, 230, 1)"
    },
    "thousandsSeparator": ",",
    "decimalFold": {
      "enabled": false,
      "threshold": 8
    },
    "zoomAnchor": "cursor",
    "dateFormat": "yyyy-MM-dd",
    "largeNumberFormat": "western"
  },
  "panes": [
    {
      "id": "pane-candle",
      "kind": "candle",
      "order": 0,
      "height": 480,
      "minHeight": 180,
      "state": "normal",
      "yAxes": [
        {
          "id": "axis-price",
          "role": "primary",
          "position": "right",
          "reverse": false,
          "inside": false,
          "scrollZoomEnabled": true,
          "topGap": 0.15,
          "bottomGap": 0.1
        }
      ],
      "indicators": []
    }
  ],
  "overlays": [
    {
      "id": "overlay-m1-horizontal-reference",
      "type": "horizontalStraightLine",
      "paneId": "pane-candle",
      "visible": true,
      "locked": false,
      "zLevel": 0,
      "mode": "normal",
      "anchor": {
        "value": 101.25
      },
      "styles": {
        "line": {
          "color": "rgba(41, 98, 255, 1)",
          "size": 1,
          "style": "solid"
        },
        "fill": {
          "color": "rgba(41, 98, 255, 0.15)"
        },
        "text": {
          "color": "rgba(255, 255, 255, 1)",
          "size": 12,
          "family": "Baron Sans",
          "weight": "normal",
          "backgroundColor": "rgba(41, 98, 255, 1)",
          "borderColor": "rgba(41, 98, 255, 1)"
        }
      },
      "metadata": {
        "labels": [
          "m1",
          "reference-line"
        ],
        "opaque": {
          "owner": "fixture-consumer",
          "revision": 1
        }
      }
    }
  ],
  "viewport": {
    "barSpace": 10,
    "rightOffsetDistance": 48,
    "anchorTimestamp": 1753920000000
  },
  "render": {
    "width": 1000,
    "height": 600,
    "deviceScaleFactor": 1,
    "background": "rgba(255, 255, 255, 1)",
    "fontFamily": "Baron Sans",
    "timeoutMs": 10000
  },
  "metadata": {
    "source": "m1-contract-fixture"
  }
}
